{"generated_at":"2026-07-22T21:22:04Z","calendar":[{"stage":"GRAP-I","start_utc":"2025-10-13T18:30:00Z","end_utc":"2026-03-15T18:30:00Z","source_url":"https://caqm.nic.in/WriteReadData/LINKS/GRAP%20Order%20dt%20141020254f778085-75c5-4ab2-aa63-6f843496c311.pdf"},{"stage":"GRAP-II","start_utc":"2025-10-18T18:30:00Z","end_utc":"2026-02-17T18:30:00Z","source_url":"https://caqm.nic.in/WriteReadData/LINKS/Invocation%20of%20GRAP%20order-%20Stage-%20II%20191020257fe54de8-42f2-456b-b1b7-75ec39e2bb14.pdf"},{"stage":"GRAP-III","start_utc":"2025-11-10T18:30:00Z","end_utc":"2025-11-25T18:30:00Z","source_url":"https://caqm.nic.in/WriteReadData/LINKS/1445%20DT%20Clarification%20to%20GRAP%20Order%20111120258942b9cc-236b-4d65-a83d-7a4ce4c4bceb.pdf"},{"stage":"GRAP-IV","start_utc":"2025-12-12T18:30:00Z","end_utc":"2025-12-23T18:30:00Z","source_url":"https://caqm.nic.in/WriteReadData/LINKS/GRAP%20Stage-IV%20invocation%20order%2013122025ed5d1f9d-5ea1-4238-896c-17979da39e91.pdf"},{"stage":"GRAP-III","start_utc":"2025-12-12T18:30:00Z","end_utc":"2026-01-21T18:30:00Z","source_url":"https://caqm.nic.in/WriteReadData/LINKS/GRAP%20Stage-IV%20invocation%20order%2013122025ed5d1f9d-5ea1-4238-896c-17979da39e91.pdf"},{"stage":"GRAP-IV","start_utc":"2026-01-16T18:30:00Z","end_utc":"2026-01-19T18:30:00Z","source_url":"https://caqm.nic.in/WriteReadData/LINKS/Invocation%20of%20GRAP%20order-%20Stage-%20IV%2017012026eb1a5169-52ec-4ebb-8381-3ee680d6f70f.pdf"}],"series":[{"ts_utc":"2025-02-01T00:00:00Z","pm25_raw":220.5,"pm25_normalized":178.6},{"ts_utc":"2025-02-02T00:00:00Z","pm25_raw":183.1,"pm25_normalized":179.1},{"ts_utc":"2025-02-03T00:00:00Z","pm25_raw":111.2,"pm25_normalized":133.1},{"ts_utc":"2025-02-04T00:00:00Z","pm25_raw":157.0,"pm25_normalized":129.8},{"ts_utc":"2025-02-05T00:00:00Z","pm25_raw":109.2,"pm25_normalized":113.1},{"ts_utc":"2025-02-06T00:00:00Z","pm25_raw":90.5,"pm25_normalized":109.7},{"ts_utc":"2025-02-07T00:00:00Z","pm25_raw":68.4,"pm25_normalized":106.4},{"ts_utc":"2025-02-08T00:00:00Z","pm25_raw":75.9,"pm25_normalized":108.5},{"ts_utc":"2025-02-09T00:00:00Z","pm25_raw":107.8,"pm25_normalized":108.3},{"ts_utc":"2025-02-10T00:00:00Z","pm25_raw":127.1,"pm25_normalized":107.0},{"ts_utc":"2025-02-11T00:00:00Z","pm25_raw":120.4,"pm25_normalized":110.4},{"ts_utc":"2025-02-12T00:00:00Z","pm25_raw":87.8,"pm25_normalized":103.2},{"ts_utc":"2025-02-13T00:00:00Z","pm25_raw":60.1,"pm25_normalized":102.8},{"ts_utc":"2025-02-14T00:00:00Z","pm25_raw":64.6,"pm25_normalized":102.7},{"ts_utc":"2025-02-15T00:00:00Z","pm25_raw":97.6,"pm25_normalized":105.1},{"ts_utc":"2025-02-16T00:00:00Z","pm25_raw":168.7,"pm25_normalized":117.4},{"ts_utc":"2025-02-17T00:00:00Z","pm25_raw":103.9,"pm25_normalized":99.7},{"ts_utc":"2025-02-18T00:00:00Z","pm25_raw":87.5,"pm25_normalized":88.8},{"ts_utc":"2025-02-19T00:00:00Z","pm25_raw":76.1,"pm25_normalized":86.3},{"ts_utc":"2025-02-20T00:00:00Z","pm25_raw":58.1,"pm25_normalized":81.6},{"ts_utc":"2025-02-21T00:00:00Z","pm25_raw":80.4,"pm25_normalized":84.6},{"ts_utc":"2025-02-22T00:00:00Z","pm25_raw":60.0,"pm25_normalized":84.9},{"ts_utc":"2025-02-23T00:00:00Z","pm25_raw":66.2,"pm25_normalized":82.1},{"ts_utc":"2025-02-24T00:00:00Z","pm25_raw":82.7,"pm25_normalized":84.5},{"ts_utc":"2025-02-25T00:00:00Z","pm25_raw":92.8,"pm25_normalized":85.2},{"ts_utc":"2025-02-26T00:00:00Z","pm25_raw":111.7,"pm25_normalized":85.3},{"ts_utc":"2025-02-27T00:00:00Z","pm25_raw":70.3,"pm25_normalized":79.6},{"ts_utc":"2025-02-28T00:00:00Z","pm25_raw":60.2,"pm25_normalized":79.0},{"ts_utc":"2025-03-01T00:00:00Z","pm25_raw":59.9,"pm25_normalized":76.2},{"ts_utc":"2025-03-02T00:00:00Z","pm25_raw":51.4,"pm25_normalized":74.4},{"ts_utc":"2025-03-03T00:00:00Z","pm25_raw":65.9,"pm25_normalized":73.1},{"ts_utc":"2025-03-04T00:00:00Z","pm25_raw":54.2,"pm25_normalized":72.9},{"ts_utc":"2025-03-05T00:00:00Z","pm25_raw":34.0,"pm25_normalized":73.8},{"ts_utc":"2025-03-06T00:00:00Z","pm25_raw":56.1,"pm25_normalized":76.7},{"ts_utc":"2025-03-07T00:00:00Z","pm25_raw":87.9,"pm25_normalized":84.9},{"ts_utc":"2025-03-08T00:00:00Z","pm25_raw":73.0,"pm25_normalized":82.6},{"ts_utc":"2025-03-09T00:00:00Z","pm25_raw":95.6,"pm25_normalized":89.8},{"ts_utc":"2025-03-10T00:00:00Z","pm25_raw":92.8,"pm25_normalized":94.7},{"ts_utc":"2025-03-11T00:00:00Z","pm25_raw":118.9,"pm25_normalized":104.7},{"ts_utc":"2025-03-12T00:00:00Z","pm25_raw":98.0,"pm25_normalized":101.6},{"ts_utc":"2025-03-13T00:00:00Z","pm25_raw":81.7,"pm25_normalized":87.8},{"ts_utc":"2025-03-14T00:00:00Z","pm25_raw":82.1,"pm25_normalized":76.4},{"ts_utc":"2025-03-15T00:00:00Z","pm25_raw":27.5,"pm25_normalized":61.9},{"ts_utc":"2025-03-16T00:00:00Z","pm25_raw":43.7,"pm25_normalized":62.9},{"ts_utc":"2025-03-17T00:00:00Z","pm25_raw":54.3,"pm25_normalized":70.1},{"ts_utc":"2025-03-18T00:00:00Z","pm25_raw":61.4,"pm25_normalized":73.1},{"ts_utc":"2025-03-19T00:00:00Z","pm25_raw":72.9,"pm25_normalized":73.0},{"ts_utc":"2025-03-20T00:00:00Z","pm25_raw":70.9,"pm25_normalized":72.8},{"ts_utc":"2025-03-21T00:00:00Z","pm25_raw":65.5,"pm25_normalized":73.2},{"ts_utc":"2025-03-22T00:00:00Z","pm25_raw":74.4,"pm25_normalized":69.9},{"ts_utc":"2025-03-23T00:00:00Z","pm25_raw":79.7,"pm25_normalized":69.6},{"ts_utc":"2025-03-24T00:00:00Z","pm25_raw":89.8,"pm25_normalized":82.8},{"ts_utc":"2025-03-25T00:00:00Z","pm25_raw":105.9,"pm25_normalized":84.9},{"ts_utc":"2025-03-26T00:00:00Z","pm25_raw":105.2,"pm25_normalized":83.0},{"ts_utc":"2025-03-27T00:00:00Z","pm25_raw":98.3,"pm25_normalized":82.7},{"ts_utc":"2025-03-28T00:00:00Z","pm25_raw":59.6,"pm25_normalized":79.7},{"ts_utc":"2025-03-29T00:00:00Z","pm25_raw":43.0,"pm25_normalized":75.2},{"ts_utc":"2025-03-30T00:00:00Z","pm25_raw":48.6,"pm25_normalized":69.9},{"ts_utc":"2025-03-31T00:00:00Z","pm25_raw":67.9,"pm25_normalized":74.5},{"ts_utc":"2025-04-01T00:00:00Z","pm25_raw":69.7,"pm25_normalized":74.1},{"ts_utc":"2025-04-02T00:00:00Z","pm25_raw":99.3,"pm25_normalized":77.3},{"ts_utc":"2025-04-03T00:00:00Z","pm25_raw":81.9,"pm25_normalized":74.8},{"ts_utc":"2025-04-04T00:00:00Z","pm25_raw":80.1,"pm25_normalized":70.7},{"ts_utc":"2025-04-05T00:00:00Z","pm25_raw":66.0,"pm25_normalized":66.9},{"ts_utc":"2025-04-06T00:00:00Z","pm25_raw":93.3,"pm25_normalized":69.7},{"ts_utc":"2025-04-07T00:00:00Z","pm25_raw":111.4,"pm25_normalized":72.6},{"ts_utc":"2025-04-08T00:00:00Z","pm25_raw":93.6,"pm25_normalized":72.2},{"ts_utc":"2025-04-09T00:00:00Z","pm25_raw":90.0,"pm25_normalized":71.1},{"ts_utc":"2025-04-10T00:00:00Z","pm25_raw":60.2,"pm25_normalized":61.5},{"ts_utc":"2025-04-11T00:00:00Z","pm25_raw":45.8,"pm25_normalized":61.2},{"ts_utc":"2025-04-12T00:00:00Z","pm25_raw":40.9,"pm25_normalized":57.8},{"ts_utc":"2025-04-13T00:00:00Z","pm25_raw":57.8,"pm25_normalized":57.9},{"ts_utc":"2025-04-14T00:00:00Z","pm25_raw":66.6,"pm25_normalized":62.2},{"ts_utc":"2025-04-15T00:00:00Z","pm25_raw":62.0,"pm25_normalized":63.3},{"ts_utc":"2025-04-16T00:00:00Z","pm25_raw":76.7,"pm25_normalized":65.7},{"ts_utc":"2025-04-17T00:00:00Z","pm25_raw":73.1,"pm25_normalized":65.7},{"ts_utc":"2025-04-18T00:00:00Z","pm25_raw":69.4,"pm25_normalized":64.7},{"ts_utc":"2025-04-19T00:00:00Z","pm25_raw":49.8,"pm25_normalized":62.9},{"ts_utc":"2025-04-20T00:00:00Z","pm25_raw":54.1,"pm25_normalized":61.5},{"ts_utc":"2025-04-21T00:00:00Z","pm25_raw":69.2,"pm25_normalized":64.7},{"ts_utc":"2025-04-22T00:00:00Z","pm25_raw":77.4,"pm25_normalized":67.5},{"ts_utc":"2025-04-23T00:00:00Z","pm25_raw":79.8,"pm25_normalized":67.6},{"ts_utc":"2025-04-24T00:00:00Z","pm25_raw":96.7,"pm25_normalized":68.2},{"ts_utc":"2025-04-25T00:00:00Z","pm25_raw":97.9,"pm25_normalized":69.6},{"ts_utc":"2025-04-26T00:00:00Z","pm25_raw":98.4,"pm25_normalized":71.1},{"ts_utc":"2025-04-27T00:00:00Z","pm25_raw":80.8,"pm25_normalized":69.8},{"ts_utc":"2025-04-28T00:00:00Z","pm25_raw":98.7,"pm25_normalized":68.8},{"ts_utc":"2025-04-29T00:00:00Z","pm25_raw":59.9,"pm25_normalized":66.9},{"ts_utc":"2025-04-30T00:00:00Z","pm25_raw":68.6,"pm25_normalized":68.6},{"ts_utc":"2025-05-01T00:00:00Z","pm25_raw":71.8,"pm25_normalized":69.7},{"ts_utc":"2025-05-02T00:00:00Z","pm25_raw":49.8,"pm25_normalized":69.8},{"ts_utc":"2025-05-03T00:00:00Z","pm25_raw":82.5,"pm25_normalized":73.9},{"ts_utc":"2025-05-04T00:00:00Z","pm25_raw":91.5,"pm25_normalized":73.1},{"ts_utc":"2025-05-05T00:00:00Z","pm25_raw":39.8,"pm25_normalized":63.1},{"ts_utc":"2025-05-06T00:00:00Z","pm25_raw":56.5,"pm25_normalized":64.9},{"ts_utc":"2025-05-07T00:00:00Z","pm25_raw":55.5,"pm25_normalized":66.7},{"ts_utc":"2025-05-08T00:00:00Z","pm25_raw":76.0,"pm25_normalized":67.4},{"ts_utc":"2025-05-09T00:00:00Z","pm25_raw":64.3,"pm25_normalized":65.7},{"ts_utc":"2025-05-10T00:00:00Z","pm25_raw":88.6,"pm25_normalized":70.3},{"ts_utc":"2025-05-11T00:00:00Z","pm25_raw":60.7,"pm25_normalized":61.6},{"ts_utc":"2025-05-12T00:00:00Z","pm25_raw":49.4,"pm25_normalized":50.6},{"ts_utc":"2025-05-13T00:00:00Z","pm25_raw":34.3,"pm25_normalized":51.1},{"ts_utc":"2025-05-14T00:00:00Z","pm25_raw":63.7,"pm25_normalized":71.7},{"ts_utc":"2025-05-15T00:00:00Z","pm25_raw":204.1,"pm25_normalized":104.4},{"ts_utc":"2025-05-16T00:00:00Z","pm25_raw":88.1,"pm25_normalized":79.4},{"ts_utc":"2025-05-17T00:00:00Z","pm25_raw":44.4,"pm25_normalized":60.0},{"ts_utc":"2025-05-18T00:00:00Z","pm25_raw":69.8,"pm25_normalized":67.0},{"ts_utc":"2025-05-19T00:00:00Z","pm25_raw":76.3,"pm25_normalized":71.0},{"ts_utc":"2025-05-20T00:00:00Z","pm25_raw":73.8,"pm25_normalized":69.4},{"ts_utc":"2025-05-21T00:00:00Z","pm25_raw":64.9,"pm25_normalized":66.7},{"ts_utc":"2025-05-22T00:00:00Z","pm25_raw":29.1,"pm25_normalized":59.5},{"ts_utc":"2025-05-23T00:00:00Z","pm25_raw":46.3,"pm25_normalized":60.0},{"ts_utc":"2025-05-24T00:00:00Z","pm25_raw":57.7,"pm25_normalized":61.5},{"ts_utc":"2025-05-25T00:00:00Z","pm25_raw":30.1,"pm25_normalized":61.9},{"ts_utc":"2025-05-26T00:00:00Z","pm25_raw":49.7,"pm25_normalized":61.5},{"ts_utc":"2025-05-27T00:00:00Z","pm25_raw":56.7,"pm25_normalized":62.3},{"ts_utc":"2025-05-28T00:00:00Z","pm25_r